{
  "$schema": "https://json-schema.org/draft/2020-12/schema",
  "$id": "https://tasleemat.pmo/schemas/completed/PMO-02.06.schema.json",
  "title": "Completed DATA PRIVACY AND ETHICS ASSESSMENT Data Contract",
  "description": "Additive structural schema validating completed DATA PRIVACY AND ETHICS ASSESSMENT artifact data payloads (PMO-02.06).",
  "type": "object",
  "properties": {
    "artifact_id": {
      "type": "string",
      "const": "PMO-02.06"
    },
    "metadata": {
      "type": "object",
      "properties": {
        "project_name": {
          "type": "string",
          "minLength": 1
        },
        "project_code": {
          "type": "string"
        },
        "date_prepared": {
          "type": "string",
          "format": "date"
        },
        "project_manager": {
          "type": "string",
          "minLength": 1
        },
        "prepared_by": {
          "type": "string",
          "minLength": 1
        },
        "version": {
          "type": "string"
        },
        "status": {
          "type": "string",
          "enum": [
            "draft",
            "baselined",
            "in_review",
            "approved"
          ]
        }
      },
      "required": [
        "project_name",
        "date_prepared",
        "project_manager",
        "prepared_by"
      ]
    },
    "scope_data_inventory_and_ownership": {
      "type": "object",
      "properties": {
        "assessment_scope": {
          "type": "string",
          "minLength": 1,
          "description": "The processing, systems, and periods this assessment covers, stated so that its edges are visible. An assessment that does not say what it excludes will be read as covering everything, and the gap between the two is where the untested processing lives."
        },
        "processing_out_of_scope": {
          "type": "string",
          "minLength": 1,
          "description": "What is explicitly not covered, and why. Excluded because another assessment covers it, or excluded because it was not looked at, are very different statements and only the second one is a finding."
        },
        "data_owners_and_custodians": {
          "type": "string",
          "minLength": 1,
          "description": "Who owns each data asset and who administers it day to day. Ownership and custody differ, and the accountability clause follows the custodian while the budget follows the owner."
        },
        "data_inventory": {
          "type": "string",
          "minLength": 1,
          "description": "One row per data asset: what it is, who owns it, the purpose it is held for, whether it holds personal data, whether that data is special category, and its volume and refresh rate. An inventory described as a count rather than as a list cannot answer any of the questions that follow."
        },
        "data_flow_and_recipients": {
          "type": "string",
          "minLength": 1,
          "description": "Where the data moves, and who receives it. The flow is what determines which transfers need a mechanism, and a flow that shows only the primary store hides the copies."
        }
      },
      "required": [
        "assessment_scope",
        "processing_out_of_scope",
        "data_owners_and_custodians",
        "data_inventory",
        "data_flow_and_recipients"
      ]
    },
    "lawful_basis_and_purpose_limitation": {
      "type": "object",
      "properties": {
        "processing_purposes_and_necessity": {
          "type": "string",
          "minLength": 1,
          "description": "What each processing activity is for, and why it cannot be achieved with less data or a shorter reach. Necessity is assessed per purpose rather than per dataset, because one dataset frequently serves several purposes with very different necessity."
        },
        "lawful_basis_by_purpose": {
          "type": "string",
          "minLength": 1,
          "description": "One row per purpose: the data processed, the basis relied on, the basis for special category data where any is present, and the justification. A form that records a basis once for a dataset will carry one basis across purposes that do not share it."
        },
        "purpose_compatibility_and_secondary_use": {
          "type": "string",
          "minLength": 1,
          "description": "Whether the data is used for any purpose other than the one collected for, and on what basis. Secondary use is the most common privacy failure in analytics work and the one least likely to be noticed, because every individual field still has a lawful origin."
        },
        "automated_decision_making": {
          "type": "string",
          "minLength": 1,
          "description": "Any decision made about a person with no meaningful human involvement, the logic involved, and the consequences for them. Recorded because the assessment of a legal basis does not by itself establish that a decision is one a person could contest."
        }
      },
      "required": [
        "processing_purposes_and_necessity",
        "lawful_basis_by_purpose",
        "purpose_compatibility_and_secondary_use",
        "automated_decision_making"
      ]
    },
    "consent_and_transparency": {
      "type": "object",
      "properties": {
        "consent_mechanism": {
          "type": "string",
          "minLength": 1,
          "description": "How consent is requested, and where in the flow it appears. Consent collected after the data is already in use is a record, not a request, and the difference determines what the record is worth."
        },
        "consent_specificity_and_granularity": {
          "type": "string",
          "minLength": 1,
          "description": "What the person was told they were consenting to, and whether the choices are separate. A single consent covering several purposes is consent to none of them in particular, and a bundle of pre-ticked boxes is not a choice."
        },
        "consent_recording_and_evidence": {
          "type": "string",
          "minLength": 1,
          "description": "Where each consent is stored, with the timestamp, the version of the text shown, and the interface shown. A consent record without the version of the text cannot be defended later, because the terms the person agreed to are then unrecoverable."
        },
        "withdrawal": {
          "type": "string",
          "minLength": 1,
          "description": "How a person withdraws, how much easier it is than granting, and what happens to data already processed on that basis. Asymmetry between granting and withdrawing is the standard test, and a withdrawal that is honoured prospectively only leaves the processing intact behind it."
        },
        "privacy_notices_and_just_in_time_disclosure": {
          "type": "string",
          "minLength": 1,
          "description": "What is told at collection, what is told at the point the data is used, and where either may be found. A notice published once and never revisited informs nobody who meets the processing for the first time in month three."
        }
      },
      "required": [
        "consent_mechanism",
        "consent_specificity_and_granularity",
        "consent_recording_and_evidence",
        "withdrawal",
        "privacy_notices_and_just_in_time_disclosure"
      ]
    },
    "individual_rights": {
      "type": "object",
      "properties": {
        "rights_handling_process": {
          "type": "string",
          "minLength": 1,
          "description": "How a request is received, routed, decided and answered, and by whom. A right stated in a policy with no route to exercise it is a stated right, and it is tested only when someone uses it."
        },
        "identity_verification": {
          "type": "string",
          "minLength": 1,
          "description": "How the requester is confirmed to be who they claim, and what is refused when that cannot be done. Verification that accepts anyone discloses data; verification that refuses everyone denies the right, and the balance is a decision to record rather than a default."
        },
        "response_timeframes_and_escalation": {
          "type": "string",
          "minLength": 1,
          "description": "The deadline for each type of request, what happens when it is missed, and who is told. The clock is the whole of the right in practice, because a correct answer delivered late is still a breach."
        },
        "rights_over_derived_shared_and_retired_data": {
          "type": "string",
          "minLength": 1,
          "description": "What happens to a request where the data has been aggregated, shared with a third party, or placed in a model. Deletion cannot reach a trained model by deleting a row, and the form that does not say so will be read as having deleted it."
        }
      },
      "required": [
        "rights_handling_process",
        "identity_verification",
        "response_timeframes_and_escalation",
        "rights_over_derived_shared_and_retired_data"
      ]
    },
    "retention_security_and_sharing": {
      "type": "object",
      "properties": {
        "retention_schedule": {
          "type": "string",
          "minLength": 1,
          "description": "One row per data asset: the retention period, the basis for that period rather than the convention, what triggers deletion, and how deletion is verified. A period adopted as a default and recorded as a decision is the most common entry, and it is the reason data outlives every justification that justified it."
        },
        "deletion_mechanism_and_coverage": {
          "type": "string",
          "minLength": 1,
          "description": "How deletion is carried out, across primary stores, replicas, logs, exports and derived copies. Deleting a row from one table while the data persists in five other places is the most frequent finding in any such assessment, and it is invisible without a coverage statement."
        },
        "backups_and_derived_data": {
          "type": "string",
          "minLength": 1,
          "description": "How deletion propagates to backups and to models trained on the data, and over what period. Backups are the usual reason a deletion is incomplete, and a trained model is a copy no deletion request reaches."
        },
        "access_controls_and_least_privilege": {
          "type": "string",
          "minLength": 1,
          "description": "Who can reach the data, by what route, under what approval, and how access is reviewed. Access is the control that fails quietly, since misuse of legitimate credentials is indistinguishable from legitimate use without a review."
        },
        "encryption_and_key_management": {
          "type": "string",
          "minLength": 1,
          "description": "What is encrypted in transit and at rest, and who holds the keys. Encryption whose keys sit beside the data is a control on paper, and the key custody arrangement is the part that is not written down."
        },
        "third_party_sharing": {
          "type": "string",
          "minLength": 1,
          "description": "One row per recipient: the recipient, the purpose, the data shared, the contractual safeguard relied on, and the region processed in. Each row needs its own basis, because a processor bound by contract to a controller is not the same arrangement as a controller sharing on its own purpose."
        },
        "cross_border_transfers": {
          "type": "string",
          "minLength": 1,
          "description": "Where data or processing leaves the jurisdiction, under which transfer mechanism, and what supplementary measures apply. A hosting region is not a transfer analysis, and remote access by a foreign staff member is a transfer that no region setting records."
        },
        "breach_notification": {
          "type": "string",
          "minLength": 1,
          "description": "What constitutes a breach here, who is notified, within what time, and who decides. Recorded because a response plan written after an incident is always written for that incident, and the decision threshold is the part that is usually left out."
        }
      },
      "required": [
        "retention_schedule",
        "deletion_mechanism_and_coverage",
        "backups_and_derived_data",
        "access_controls_and_least_privilege",
        "encryption_and_key_management",
        "third_party_sharing",
        "cross_border_transfers",
        "breach_notification"
      ]
    },
    "ethics_beyond_compliance": {
      "type": "object",
      "properties": {
        "harm_beyond_legal_exposure": {
          "type": "string",
          "minLength": 1,
          "description": "Where this processing causes harm that no law prohibits. This section exists because compliance is a floor: processing can be lawful, consented, retained properly and shared properly, and still be wrong, and a form that stops at lawful has answered the question it was easy to answer."
        },
        "vulnerable_individuals_and_groups": {
          "type": "string",
          "minLength": 1,
          "description": "Who is affected in a state of reduced ability to refuse, to understand, or to bear the consequence. Vulnerability here is a property of the situation rather than of the person, and it is invisible to a record of categories and volumes."
        },
        "transparency_to_affected_people": {
          "type": "string",
          "minLength": 1,
          "description": "What the people in the data are actually told, in language they use, as distinct from what the notice says. A notice that is accurate, complete and unread is the standard failure, and reading it as a recipient rather than as a drafter is the only way to see it."
        },
        "manipulation_dark_patterns_and_consent_fatigue": {
          "type": "string",
          "minLength": 1,
          "description": "Whether the interface nudges, pre-ticks, buries refusal, or asks repeatedly, and whether the volume of requests is such that a refusal is impractical. Consent obtained by a design choice is not freely given, whatever the record says."
        },
        "fairness_of_automated_decisions": {
          "type": "string",
          "minLength": 1,
          "description": "Whether the processing produces outcomes for people, and what the distribution of those outcomes is across groups. A lawful basis for a decision is not a defence of its fairness, and the two are assessed against different questions."
        }
      },
      "required": [
        "harm_beyond_legal_exposure",
        "vulnerable_individuals_and_groups",
        "transparency_to_affected_people",
        "manipulation_dark_patterns_and_consent_fatigue",
        "fairness_of_automated_decisions"
      ]
    },
    "findings_remediation_and_review": {
      "type": "object",
      "properties": {
        "findings_register": {
          "type": "string",
          "minLength": 1,
          "description": "One row per finding: the finding, the risk it poses to individuals, the severity, the owner, and the action being taken. Severity is what determines the order of work, and a register with no severity column is a list of observations."
        },
        "residual_risk_and_acceptance": {
          "type": "string",
          "minLength": 1,
          "description": "The risk remaining after the planned actions, who accepts it, and until when. Acceptance is a decision with an owner and an expiry date; an acceptance with neither is an unowned risk that will be rediscovered at the next assessment."
        },
        "remediation_plan": {
          "type": "string",
          "minLength": 1,
          "description": "The actions, their owners and their dates, and what is being done in the interim. The interim period is where a known finding actually operates, so it is the part of the plan most worth writing down."
        },
        "review_triggers": {
          "type": "string",
          "minLength": 1,
          "description": "What would cause this assessment to be revisited before its scheduled date, such as a new purpose, a new recipient, a new model, or a regulatory change. Triggers stated after the change have occurred are a record of the change."
        },
        "reassessment_triggers": {
          "type": "string",
          "minLength": 1,
          "description": "When this assessment expires and on what cycle. An assessment with no expiry is treated as permanent by everyone who did not write it, including the people who inherited it."
        }
      },
      "required": [
        "findings_register",
        "residual_risk_and_acceptance",
        "remediation_plan",
        "review_triggers",
        "reassessment_triggers"
      ]
    }
  },
  "required": [
    "artifact_id",
    "metadata",
    "scope_data_inventory_and_ownership",
    "lawful_basis_and_purpose_limitation",
    "consent_and_transparency",
    "individual_rights",
    "retention_security_and_sharing",
    "ethics_beyond_compliance",
    "findings_remediation_and_review"
  ]
}